{
  "$schema": "./schemas/instruction-contract.schema.json",
  "schemaVersion": 1,
  "protocolRevision": "pr45-5a9abcb3",
  "programs": [
    {
      "name": "dusk",
      "programId": "JA8Zxxm4t4zopBL8e3dQQXWfQ3a5pBUPY9Sp9RnybV2X",
      "idlPath": "artifacts/dusk.json",
      "idlSha256": "87b6764662192fe85d8c60e6b777fc846f8f657bf8860fd81a94fa5c3bb99246"
    },
    {
      "name": "leverage_delegate",
      "programId": "AXNfmZt5e1UM4daeTzW3H7zNo4boobBcnFm8RzJYxvAv",
      "idlPath": "artifacts/leverage_delegate.json",
      "idlSha256": "901ff9e41ca9b5c860e7fc6183cf0e9a4c0476488545bcfd02332cad5a470dd1"
    }
  ],
  "actions": [
    {
      "action": "flash_liquidation_settle",
      "jobKind": "lending_liquidation_bid",
      "primaryInstructionKey": "dusk:settle_flash_liquidation",
      "cpiInstructionKeys": [],
      "requiredOptionalAccounts": []
    },
    {
      "action": "flash_liquidation_preview",
      "jobKind": "lending_liquidation_bid",
      "primaryInstructionKey": "dusk:preview_flash_liquidation",
      "cpiInstructionKeys": [],
      "requiredOptionalAccounts": []
    },
    {
      "action": "emergency_liquidation_preview",
      "jobKind": "lending_liquidation_settle",
      "primaryInstructionKey": "dusk:preview_emergency_liquidation",
      "cpiInstructionKeys": [],
      "requiredOptionalAccounts": []
    },
    {
      "action": "lending_liquidation_trigger",
      "jobKind": "lending_liquidation_trigger",
      "primaryInstructionKey": "dusk:observe_liquidation",
      "cpiInstructionKeys": [],
      "requiredOptionalAccounts": []
    },
    {
      "action": "lending_liquidation_bid",
      "jobKind": "lending_liquidation_bid",
      "primaryInstructionKey": "dusk:begin_flash_liquidation",
      "cpiInstructionKeys": [],
      "requiredOptionalAccounts": []
    },
    {
      "action": "lending_liquidation_floor_settle",
      "jobKind": "lending_liquidation_settle",
      "primaryInstructionKey": "dusk:emergency_liquidation",
      "cpiInstructionKeys": [],
      "requiredOptionalAccounts": []
    },
    {
      "action": "leverage_liquidation",
      "jobKind": "leverage_liquidation",
      "primaryInstructionKey": "dusk:observe_liquidation",
      "cpiInstructionKeys": [],
      "requiredOptionalAccounts": []
    },
    {
      "action": "delegated_close_take_profit",
      "jobKind": "take_profit",
      "primaryInstructionKey": "dusk:delegated_close_leverage",
      "cpiInstructionKeys": [
        "leverage_delegate:before_take_profit",
        "leverage_delegate:after_close_order"
      ],
      "requiredOptionalAccounts": [
        "leverage_delegation",
        "delegated_program"
      ]
    },
    {
      "action": "delegated_close_stop_loss",
      "jobKind": "stop_loss",
      "primaryInstructionKey": "dusk:delegated_close_leverage",
      "cpiInstructionKeys": [
        "leverage_delegate:before_stop_loss",
        "leverage_delegate:after_close_order"
      ],
      "requiredOptionalAccounts": [
        "leverage_delegation",
        "delegated_program"
      ]
    },
    {
      "action": "protocol_revenue_auction_settle",
      "jobKind": "auction_bid",
      "primaryInstructionKey": "dusk:settle_protocol_auction",
      "cpiInstructionKeys": [],
      "requiredOptionalAccounts": []
    },
    {
      "action": "eligible_proposal_queue",
      "jobKind": "lifecycle",
      "primaryInstructionKey": "dusk:queue_parameter_proposal",
      "cpiInstructionKeys": [],
      "requiredOptionalAccounts": []
    },
    {
      "action": "eligible_proposal_execute",
      "jobKind": "lifecycle",
      "primaryInstructionKey": "dusk:execute_parameter_proposal",
      "cpiInstructionKeys": [],
      "requiredOptionalAccounts": []
    }
  ],
  "instructions": [
    {
      "key": "dusk:settle_flash_liquidation",
      "program": "dusk",
      "programId": "JA8Zxxm4t4zopBL8e3dQQXWfQ3a5pBUPY9Sp9RnybV2X",
      "instructionName": "settle_flash_liquidation",
      "discriminatorHex": "a15d5938857c4f14",
      "accounts": [
        {
          "name": "market",
          "writable": true,
          "signer": false,
          "optional": false,
          "fixedAddress": null
        },
        {
          "name": "borrow_position",
          "writable": true,
          "signer": false,
          "optional": true,
          "fixedAddress": null
        },
        {
          "name": "leverage_position",
          "writable": true,
          "signer": false,
          "optional": true,
          "fixedAddress": null
        },
        {
          "name": "buyer",
          "writable": true,
          "signer": true,
          "optional": false,
          "fixedAddress": null
        },
        {
          "name": "collateral_mint",
          "writable": false,
          "signer": false,
          "optional": false,
          "fixedAddress": null
        },
        {
          "name": "debt_mint",
          "writable": false,
          "signer": false,
          "optional": false,
          "fixedAddress": null
        },
        {
          "name": "collateral_vault",
          "writable": true,
          "signer": false,
          "optional": false,
          "fixedAddress": null
        },
        {
          "name": "reserve_vault",
          "writable": true,
          "signer": false,
          "optional": false,
          "fixedAddress": null
        },
        {
          "name": "interest_vault",
          "writable": true,
          "signer": false,
          "optional": false,
          "fixedAddress": null
        },
        {
          "name": "insurance_vault",
          "writable": true,
          "signer": false,
          "optional": false,
          "fixedAddress": null
        },
        {
          "name": "buyer_collateral_account",
          "writable": true,
          "signer": false,
          "optional": false,
          "fixedAddress": null
        },
        {
          "name": "buyer_refund_account",
          "writable": true,
          "signer": false,
          "optional": false,
          "fixedAddress": null
        },
        {
          "name": "owner_debt_account",
          "writable": true,
          "signer": false,
          "optional": false,
          "fixedAddress": null
        },
        {
          "name": "futarchy_authority",
          "writable": false,
          "signer": false,
          "optional": false,
          "fixedAddress": null
        },
        {
          "name": "referral_partner",
          "writable": false,
          "signer": false,
          "optional": true,
          "fixedAddress": null
        },
        {
          "name": "referral_accrual",
          "writable": true,
          "signer": false,
          "optional": true,
          "fixedAddress": null
        },
        {
          "name": "token_program",
          "writable": false,
          "signer": false,
          "optional": false,
          "fixedAddress": "TokenkegQfeZyiNwAJbNbGKPFXCWuBvf9Ss623VQ5DA"
        },
        {
          "name": "token_2022_program",
          "writable": false,
          "signer": false,
          "optional": false,
          "fixedAddress": "TokenzQdBNbLqP5VEhdkAS6EPFLC1PHnBqCXEpPxuEb"
        },
        {
          "name": "debt_token_program",
          "writable": false,
          "signer": false,
          "optional": false,
          "fixedAddress": null
        },
        {
          "name": "session",
          "writable": true,
          "signer": false,
          "optional": false,
          "fixedAddress": null
        },
        {
          "name": "repayment_vault",
          "writable": true,
          "signer": false,
          "optional": false,
          "fixedAddress": null
        },
        {
          "name": "collateral_reserve_vault",
          "writable": true,
          "signer": false,
          "optional": true,
          "fixedAddress": null
        },
        {
          "name": "instructions",
          "writable": false,
          "signer": false,
          "optional": false,
          "fixedAddress": "Sysvar1nstructions1111111111111111111111111"
        },
        {
          "name": "event_authority",
          "writable": false,
          "signer": false,
          "optional": false,
          "fixedAddress": null
        },
        {
          "name": "program",
          "writable": false,
          "signer": false,
          "optional": false,
          "fixedAddress": null
        }
      ]
    },
    {
      "key": "dusk:preview_flash_liquidation",
      "program": "dusk",
      "programId": "JA8Zxxm4t4zopBL8e3dQQXWfQ3a5pBUPY9Sp9RnybV2X",
      "instructionName": "preview_flash_liquidation",
      "discriminatorHex": "ee5e7af3d6aff603",
      "accounts": [
        {
          "name": "market",
          "writable": false,
          "signer": false,
          "optional": false,
          "fixedAddress": null
        },
        {
          "name": "borrow_position",
          "writable": false,
          "signer": false,
          "optional": true,
          "fixedAddress": null
        },
        {
          "name": "leverage_position",
          "writable": false,
          "signer": false,
          "optional": true,
          "fixedAddress": null
        },
        {
          "name": "collateral_mint",
          "writable": false,
          "signer": false,
          "optional": false,
          "fixedAddress": null
        },
        {
          "name": "debt_mint",
          "writable": false,
          "signer": false,
          "optional": false,
          "fixedAddress": null
        }
      ]
    },
    {
      "key": "dusk:preview_emergency_liquidation",
      "program": "dusk",
      "programId": "JA8Zxxm4t4zopBL8e3dQQXWfQ3a5pBUPY9Sp9RnybV2X",
      "instructionName": "preview_emergency_liquidation",
      "discriminatorHex": "4bc8420070e61838",
      "accounts": [
        {
          "name": "market",
          "writable": false,
          "signer": false,